{
  "id": "event_epilogue_exploited",
  "kind": "dialogue",
  "requires_flag": "station_mode_exploit",
  "once": true,
  "steps": [
    {"type": "line", "speaker": "洛弦", "text_zh": "产量表很漂亮，漂亮得有点刺眼。矿脉的低鸣比我们来时沉了一度——这一栏，账本上没有。"},
    {"type": "line", "speaker": "弥砂", "text_zh": "我还是会替每一车矿尘小声说一句\"借了\"。它没有回应，但它一定听得见。"},
    {"type": "line", "speaker": "洛弦", "text_zh": "欠下的总要还。把今天的读数封存好——将来补账的人，得知道利息是从哪一天开始算的。"},
    {"type": "line", "speaker": "弥砂", "text_zh": "嗯，到那天，我陪你一起来还。"}
  ]
}
